{
  "$schema": "./schemas/project.schema.json",
  "specVersion": "1.0.0",
  "project": {
    "id": "8f1c2e0a-5b7d-4c3e-9a1f-2d6b8e4c7a90",
    "name": "Product Launch Demo",
    "sources": {
      "productUrl": "https://example.com",
      "requiresLogin": true,
      "sourceCodePath": "../my-product",
      "description": "使用者補充的產品說明",
      "referenceVideoUrl": null
    },
    "targetAudience": "開發者",
    "language": "zh-TW",
    "format": {
      "aspectRatio": "16:9",
      "width": 1920,
      "height": 1080,
      "fps": 30,
      "targetDurationSec": 45
    },
    "audio": {
      "bgm": "assets/bgm.mp3",
      "bgmVolume": 0.25,
      "ducking": true,
      "music": {
        "preset": "corporate",
        "instruments": [
          "piano",
          "pad",
          "bass",
          "drums"
        ],
        "key": "D",
        "progression": [
          "I",
          "V",
          "vi",
          "IV"
        ],
        "seed": 3,
        "sections": {
          "scene-001": {
            "energy": "high"
          },
          "scene-002": {
            "energy": "low",
            "mode": "minor",
            "instruments": [
              "strings",
              "bass"
            ],
            "melody": false
          }
        },
        "themes": [
          {
            "id": "main",
            "instrument": "piano",
            "notes": [
              {
                "beat": 0,
                "beats": 1,
                "degree": 1
              },
              {
                "beat": 1,
                "beats": 1,
                "degree": 3
              },
              {
                "beat": 2,
                "beats": 2,
                "degree": 5
              },
              {
                "beat": 4,
                "beats": 1,
                "degree": 6
              },
              {
                "beat": 5,
                "beats": 1,
                "degree": 5
              },
              {
                "beat": 6,
                "beats": 2,
                "degree": 3
              }
            ]
          }
        ],
        "cues": [
          {
            "scene": "scene-002",
            "at": 2.5,
            "type": "dropout",
            "beats": 1
          },
          {
            "scene": "scene-002",
            "at": 2.5,
            "type": "hit"
          }
        ]
      }
    },
    "captions": {
      "mode": "srt",
      "style": {
        "fontFamily": "Noto Sans TC",
        "fontSize": 48,
        "position": "bottom"
      }
    },
    "tts": {
      "provider": "edge-tts",
      "voice": "zh-TW-HsiaoChenNeural",
      "consent": {
        "onlineTts": true,
        "grantedAt": "2026-09-30T13:00:00Z"
      }
    },
    "x-team": "growth"
  },
  "scenes": [
    {
      "id": "scene-001",
      "dir": "scenes/001-hook"
    },
    {
      "id": "scene-002",
      "dir": "scenes/002-problem"
    },
    {
      "id": "scene-003",
      "dir": "scenes/003-solution"
    }
  ],
  "status": "producing",
  "updatedAt": "2026-09-30T14:00:00Z",
  "updatedBy": "agent"
}
